{
  "schema_version": "1.0.0",
  "dimensions": [
    "S1",
    "S2",
    "S3",
    "S4",
    "S5"
  ],
  "scales": [
    "MACRO-A",
    "MACRO-B",
    "MACRO-C",
    "MICRO-A",
    "MICRO-B"
  ],
  "cells": [
    {
      "id": "S1xMACRO-A",
      "dimension": "S1",
      "scale": "MACRO-A",
      "criterion": "跨仓组合战略对齐：各仓定位声明与组合叙事 embedding 收敛度、跨仓依赖方向与声明分工一致性",
      "data_source": [
        "各仓 README/roadmap",
        "跨仓依赖图",
        "组合战略声明"
      ],
      "threshold": {
        "yellow": {
          "metric": "portfolio_convergence_mean",
          "operator": "<",
          "value": 0.75
        },
        "red": {
          "metric": "portfolio_convergence_mean",
          "operator": "<",
          "value": 0.6
        }
      },
      "scoring": "index",
      "risk_weight": 2,
      "machine_checkable": true,
      "provenance": {
        "origin": "expert",
        "version": "v1",
        "calibrated_date": "2026-09-11",
        "expires_at": "2026-12-10",
        "sample_size": 0
      },
      "notes": "红级叠加条件：任意两仓定位声明直接冲突"
    },
    {
      "id": "S1xMACRO-B",
      "dimension": "S1",
      "scale": "MACRO-B",
      "criterion": "README 一句话定位/roadmap 与实际交付（PR 标题、issue 分流、CHANGELOG）的关键词+embedding 覆盖率与漂移起点检测",
      "data_source": [
        "README/docs/roadmap",
        "CHANGELOG",
        "git log",
        "issue+label",
        "PR 标题"
      ],
      "threshold": {
        "yellow": {
          "metric": "positioning_keyword_coverage",
          "operator": "<",
          "value": 0.7
        },
        "red": {
          "metric": "positioning_keyword_coverage",
          "operator": "<",
          "value": 0.5
        }
      },
      "scoring": "percent",
      "risk_weight": 3,
      "machine_checkable": true,
      "provenance": {
        "origin": "expert",
        "version": "v1",
        "calibrated_date": "2026-09-11",
        "expires_at": "2026-12-10",
        "sample_size": 0
      },
      "notes": "70% 为初版 expert 参数非 hard rule（per Decision 4.1）；embedding 选型+关键词 fallback+人工抽检"
    },
    {
      "id": "S1xMACRO-C",
      "dimension": "S1",
      "scale": "MACRO-C",
      "criterion": "定位覆盖度 rolling window 时间序列与漂移起点（连续下滑趋势）检测",
      "data_source": [
        "git log",
        "CHANGELOG",
        "roadmap 归档"
      ],
      "threshold": {
        "yellow": {
          "metric": "coverage_delta_12m_pp",
          "operator": "<",
          "value": -10
        },
        "red": {
          "metric": "coverage_delta_12m_pp",
          "operator": "<",
          "value": -25
        }
      },
      "scoring": "percent",
      "risk_weight": 2,
      "machine_checkable": true,
      "provenance": {
        "origin": "expert",
        "version": "v1",
        "calibrated_date": "2026-09-11",
        "expires_at": "2026-12-10",
        "sample_size": 0
      }
    },
    {
      "id": "S1xMICRO-A",
      "dimension": "S1",
      "scale": "MICRO-A",
      "criterion": "PR 标题/描述与声明定位的语义相关度（off-topic 检测）",
      "data_source": [
        "PR 标题/描述",
        "定位关键词表",
        "embedding 服务"
      ],
      "threshold": {
        "yellow": {
          "metric": "pr_positioning_relevance",
          "operator": "<",
          "value": 0.5
        },
        "red": {
          "metric": "pr_positioning_relevance",
          "operator": "<",
          "value": 0.3
        }
      },
      "scoring": "index",
      "risk_weight": 1,
      "machine_checkable": true,
      "provenance": {
        "origin": "expert",
        "version": "v1",
        "calibrated_date": "2026-09-11",
        "expires_at": "2026-12-10",
        "sample_size": 0
      },
      "notes": "红级叠加条件：30 天内同主题 off-topic 达 5 个"
    },
    {
      "id": "S1xMICRO-B",
      "dimension": "S1",
      "scale": "MICRO-B",
      "criterion": "文件/模块归属定位声明功能面（孤儿模块检测）",
      "data_source": [
        "文件路径/模块地图",
        "定位关键词表"
      ],
      "threshold": {
        "yellow": {
          "metric": "module_belonging_score",
          "operator": "<",
          "value": 0.4
        },
        "red": {
          "metric": "module_belonging_score",
          "operator": "<",
          "value": 0.2
        }
      },
      "scoring": "index",
      "risk_weight": 1,
      "machine_checkable": true,
      "provenance": {
        "origin": "expert",
        "version": "v1",
        "calibrated_date": "2026-09-11",
        "expires_at": "2026-12-10",
        "sample_size": 0
      },
      "notes": "advisory，不进入裁决路径；红级叠加条件：无 out-of-scope 声明"
    },
    {
      "id": "S2xMACRO-A",
      "dimension": "S2",
      "scale": "MACRO-A",
      "criterion": "跨仓 ADR 治理一致性：关键决策 ADR 覆盖率、模板一致性、supersede 链健康度",
      "data_source": [
        "各仓 docs/adr/ 全量结构扫描",
        "跨仓共享决策清单"
      ],
      "threshold": {
        "yellow": {
          "metric": "adr_structure_completeness_mean",
          "operator": "<",
          "value": 0.6
        },
        "red": {
          "metric": "adr_structure_completeness_mean",
          "operator": "<",
          "value": 0.4
        }
      },
      "scoring": "ratio",
      "risk_weight": 2,
      "machine_checkable": true,
      "provenance": {
        "origin": "expert",
        "version": "v1",
        "calibrated_date": "2026-09-11",
        "expires_at": "2026-12-10",
        "sample_size": 0
      }
    },
    {
      "id": "S2xMACRO-B",
      "dimension": "S2",
      "scale": "MACRO-B",
      "criterion": "ADR 真决策五要素（Context 张力/Considered Options/正负 Consequences/immutable+supersede 链/决策当时写）+ YAML 时间戳头一致性",
      "data_source": [
        "docs/adr/ 全量结构扫描",
        "git log --follow"
      ],
      "threshold": {
        "yellow": {
          "metric": "adr_element_completeness",
          "operator": "<",
          "value": 0.8
        },
        "red": {
          "metric": "adr_backdated_gt90d_ratio",
          "operator": ">",
          "value": 0.2
        }
      },
      "scoring": "ratio",
      "risk_weight": 3,
      "machine_checkable": true,
      "provenance": {
        "origin": "expert",
        "version": "v1",
        "calibrated_date": "2026-09-11",
        "expires_at": "2026-12-10",
        "sample_size": 0
      },
      "notes": "红阈值=事后补写>90 天占比>20%（per Decision 4.2 初版参数）"
    },
    {
      "id": "S2xMACRO-C",
      "dimension": "S2",
      "scale": "MACRO-C",
      "criterion": "ADR 撰写时点与决策发生时点的滞后分布 + TODO/FIXME 密度对照",
      "data_source": [
        "git log --follow",
        "ADR 头时间戳",
        "TODO/FIXME 扫描"
      ],
      "threshold": {
        "yellow": {
          "metric": "adr_lag_median_days",
          "operator": ">",
          "value": 30
        },
        "red": {
          "metric": "adr_lag_median_days",
          "operator": ">",
          "value": 90
        }
      },
      "scoring": "count",
      "risk_weight": 2,
      "machine_checkable": true,
      "provenance": {
        "origin": "expert",
        "version": "v1",
        "calibrated_date": "2026-09-11",
        "expires_at": "2026-12-10",
        "sample_size": 0
      },
      "notes": "时间戳头缺失时回退 git log 首次出现日（per Decision 4.2 回退方案）"
    },
    {
      "id": "S2xMICRO-A",
      "dimension": "S2",
      "scale": "MICRO-A",
      "criterion": "架构级变更 PR 与 ADR 创建/更新的绑定率（decision-PR binding）",
      "data_source": [
        "CodeLore diff --llm 架构变更分类",
        "ADR 文件变更"
      ],
      "threshold": {
        "yellow": {
          "metric": "adr_pr_binding_missing_ratio",
          "operator": ">",
          "value": 0.2
        },
        "red": {
          "metric": "adr_pr_binding_missing_ratio",
          "operator": ">",
          "value": 0.4
        }
      },
      "scoring": "ratio",
      "risk_weight": 2,
      "machine_checkable": true,
      "provenance": {
        "origin": "expert",
        "version": "v1",
        "calibrated_date": "2026-09-11",
        "expires_at": "2026-12-10",
        "sample_size": 0
      }
    },
    {
      "id": "S2xMICRO-B",
      "dimension": "S2",
      "scale": "MICRO-B",
      "criterion": "单个 ADR 文件模板结构完备性（必填 section 与 Status 齐备）",
      "data_source": [
        "单 ADR markdown 结构解析"
      ],
      "threshold": {
        "yellow": {
          "metric": "adr_missing_sections",
          "operator": ">",
          "value": 0
        },
        "red": {
          "metric": "adr_missing_sections",
          "operator": ">",
          "value": 1
        }
      },
      "scoring": "count",
      "risk_weight": 1,
      "machine_checkable": true,
      "provenance": {
        "origin": "expert",
        "version": "v1",
        "calibrated_date": "2026-09-11",
        "expires_at": "2026-12-10",
        "sample_size": 0
      },
      "notes": "advisory，进入文件质量卡"
    },
    {
      "id": "S3xMACRO-A",
      "dimension": "S3",
      "scale": "MACRO-A",
      "criterion": "跨仓重复抽象簇与门面投入对比（同型抽象跨仓计数、共享库利用率）",
      "data_source": [
        "各仓 CodeLore 抽象清单",
        "跨仓依赖图"
      ],
      "threshold": {
        "yellow": {
          "metric": "duplicate_abstraction_clusters",
          "operator": ">",
          "value": 2
        },
        "red": {
          "metric": "duplicate_abstraction_clusters",
          "operator": ">",
          "value": 4
        }
      },
      "scoring": "count",
      "risk_weight": 2,
      "machine_checkable": true,
      "provenance": {
        "origin": "expert",
        "version": "v1",
        "calibrated_date": "2026-09-11",
        "expires_at": "2026-12-10",
        "sample_size": 0
      },
      "notes": "红级叠加条件：无合并计划"
    },
    {
      "id": "S3xMACRO-B",
      "dimension": "S3",
      "scale": "MACRO-B",
      "criterion": "God Object/巨类/单实现抽象/范式通胀密度 vs 结构投入（边界清晰/内聚/适度抽象）",
      "data_source": [
        "CodeLore 上帝对象分析",
        "抽象利用率",
        "shearing layers 识别"
      ],
      "threshold": {
        "yellow": {
          "metric": "single_impl_abstraction_ratio",
          "operator": ">",
          "value": 0.3
        },
        "red": {
          "metric": "single_impl_abstraction_ratio",
          "operator": ">",